{
  "version": 1,
  "demand": "fu-31-review-must-fix-v15-network",
  "agent": "developer-engineer",
  "phase": "Execution",
  "gitSha": "2876e86",
  "commands": [
    {
      "cmd": "node --test \".opencode/plugins/__tests__/*.spec.mjs\" && node --test \"installer/__tests__/*.spec.mjs\" && node scripts/static-checks.mjs && node scripts/vendor-skills.mjs --check",
      "exitCode": 0,
      "durationMs": 501,
      "stdoutHash": "sha256:pending"
    }
  ],
  "counts": {
    "unit": { "passed": 302, "failed": 0, "skipped": 0 },
    "it": { "passed": 0, "failed": 0, "skipped": 0 },
    "frontend": { "passed": 0, "failed": 0, "skipped": 0 }
  },
  "evaluation": {
    "telas": "n/a-repo-sem-ui (stack backend/frontend = N/A em harness.config.json)",
    "negocio": "ok-5 must-fix do review FU-31 fechados: MF-1 rotulo ambiguo (I8) renomeado para V15/rede-installer no codigo + redacao pronta da linha de gate entregue ao orchestrator (mecanismo: checkV15 em scripts/static-checks.mjs rodando em commands.suiteFull + CI harness-integrity; garantia 🟠 parcial); MF-2 escape E5 (side-effect import sem binding) coberto por regex e teste; MF-3 escape E6 (subcomando apos flag em string/array) coberto por regex e teste; MF-4 redacao do escape E1 corrigida para os fatos (dogfood-mobile runCommand via shell:/bin/sh recebe cmd de --suite-command ou commands.suiteFull do harness.config.json do INSTALLER_ROOT); MF-5 contraprova de bypass em network.spec.mjs (6 testes novos). Extras: bun add/npx/flutter+dart pub get na classe fechada, new globalThis.WebSocket coberto; arestas residuais DECLARADAS (E5 array-form FP residual, E6 comandos fora da lista, E2 alias, E3 specifier dinamico/import sem espaco, E4 builtins internos) — nenhuma garantia inventada.",
    "logica": "ok-regexes ancorados em specifier/subcomando quotado; zero falso-positivo no repo real (guardiao networkCheck(installer/) verde; padroes dogfood reespelhados em teste)",
    "perf": "n/a-check puro em fs, linha-inteira"
  },
  "brainStore": [
    "regras/projetos/harness/fu-31-v15-network-class"
  ],
  "cleanup": {
    "ports": [],
    "note": "nenhum servidor/porta subido neste batch (infra.ports nulos em harness.config.json); nada a encerrar; nenhum pkill -f executado"
  },
  "selfReported": true
}
