{
  "version": 1,
  "demand": "fu-31-rodada-final-redos-array-bound",
  "agent": "developer-engineer",
  "phase": "Execution",
  "gitSha": "2876e86",
  "commands": [
    {
      "cmd": "node --test \".opencode/plugins/__tests__/*.spec.mjs\" && node --test \"installer/__tests__/*.spec.mjs\" && node scripts/static-checks.mjs && node scripts/vendor-skills.mjs --check",
      "exitCode": 0,
      "durationMs": 416,
      "stdoutHash": "sha256:ccba94580fdd8eeceef39577db051b39b31e965d189cbdc963f68d2256775c74"
    }
  ],
  "counts": {
    "unit": { "passed": 313, "failed": 0, "skipped": 0 },
    "it": { "passed": 0, "failed": 0, "skipped": 0 },
    "frontend": { "passed": 0, "failed": 0, "skipped": 0 }
  },
  "evaluation": {
    "telas": "n/a-repo-sem-ui (stack backend/frontend = N/A em harness.config.json)",
    "negocio": "ok-rodada final FU-31 fecha RE-1 pela metade array: patterns net-git-cmd-array e net-pkg-cmd-array usavam [^\\]]* sem limite superior — forma multi-ocorrencia ('[\"git\", '.repeat(8000), 64k chars) media 305ms sem bound (O(n²); contrato <50ms violado); fix prescrito/verificado pelo reviewer = [^\\]]{0,200}; semantica preservada nos 6 casos do reviewer (4 HIT: [\"clone\",u], [\"-C\",repo,\"clone\",url], [\"-c\",\"a=b\",\"-c\",\"c=d\",\"push\",...], [\"--git-dir\",a,\"--work-tree\",b,\"fetch\",\"--all\"]; 2 MISS: git status, git rev-parse); TDD provado: teste de tempo array RED 559ms antes do fix, GREEN ~20ms depois; teste do limite declarado (elemento >200 chars nao casa) RED→GREEN; D-1 describe E5/E6-legado renomeado (colisao de rotulo); D-2 escape E9 declarado (execFileSync(\"npx\", [...]) escapa — so forma string-unica casa) com contraprova; D-3 FP residual \"npx --version\" anotado no header, NAO cacado (regra de parada: nenhum escape novo perseguido)",
    "logica": "ok-bounds aplicados nos 2 patterns array; header de static-checks.mjs documenta bound {0,200}, limite declarado e E9/FP-npx; zero falso-positivo no repo real (checkV15 PASS rede em installer/=0; guardiao networkCheck(installer/) verde nos 26 testes de network.spec.mjs); suiteFull completa 313/313 + static todos PASS + vendor OK",
    "perf": "ok-teste de tempo no caminho array (nao exercitado antes): forma multi-ocorrencia 559ms→~20ms com bound; custo por tentativa <=200 passos; forma linear (1.2M chars) ~1.5ms; contrato <50ms verify"
  },
  "brainStore": [
    "regras/projetos/projetos/harness/v15-redos-array-bound-rodada-final"
  ],
  "cleanup": {
    "ports": [],
    "note": "nenhum servidor/porta subido (infra.ports nulos em harness.config.json); nada a encerrar; nenhum pkill -f executado; teste RED medido in-process (559ms, encerrou sozinho)"
  },
  "selfReported": true
}
